{
  "workflow_id": "daily-posts-heartbeat",
  "adapter": "generic-mcp",
  "account_handle": "@example_creator",
  "action": "schedule_post",
  "approved_text": ["approved example text"],
  "approved_text_sha256": "hash-placeholder",
  "status": "scheduled",
  "timestamp": "2026-06-02T10:00:00Z",
  "timezone": "Australia/Perth",
  "tool_path": [
    "get_connection_defaults",
    "validate_post",
    "schedule_post",
    "get_schedule_status",
    "get_schedule_report"
  ],
  "fallback_used": false,
  "artifact_ids": ["redacted-artifact-id"]
}
